{
  "code": "fr",
  "name": "FranÃ§ais",
  "stopwords": [
    "le", "la", "les", "de", "du", "des", "un", "une", "et", "est",
    "dans", "pour", "avec", "sur", "par", "au", "aux", "ce", "cette",
    "ces", "qui", "que", "ne", "pas", "plus", "son", "sa", "ses",
    "mon", "ma", "mes", "il", "elle", "nous", "vous", "leur", "ÃŠtre",
    "avoir", "faire", "tout", "bien", "aussi", "comme", "mais", "oÃđ",
    "quand", "si", "trÃĻs", "ici", "entre", "mÃŠme", "encore", "alors",
    "car", "donc", "dont", "elle", "eux", "y", "en", "on", "lui",
    "bonjour", "salut", "bonsoir"
  ],
  "patterns": {
    "fast": [
      "^(salut|bonjour|bonsoir|merci|au revoir|coucou)[!.,\\s]?$",
      "^(ok|oui|non|d'accord|parfait|super|bien|entendu|compris|c'est bon)[!.,\\s]?$",
      "^(qu'est-ce que|quel|quelle|quels|quelles) ",
      "^comment (faire|puis-je|est-ce que) ",
      "^(montre|liste|affiche|donne|montre-moi) .{0,30}$",
      "\\b(formater|formatte|formater le code|traduire|convertir|renommer|trier|nettoyer)\\b",
      "\\bgit (status|log|diff|add|commit|push|pull|branch|checkout|merge|stash|rebase)\\b",
      "\\b(json|yaml|yml|toml|csv|xml|html|markdown|md)\\b.{0,20}$",
      "\\bregex\\b",
      "\\bsyntaxe (de|pour|du)\\b",
      "^(qu'est-ce que|comment|oÃđ|quel|quand).{0,50}\\?$",
      "^(explique|dÃĐcris|rÃĐsume|dÃĐfinis) .{0,40}$"
    ],
    "standard": [
      "\\b(crÃĐe[rz]?|ÃĐcri[rstz]+|fai[rst]+|ajoute[rz]?|construi[rstz]+) .{0,20}(fonction|mÃĐthode|classe|composant|module|handler|endpoint|route|service|contrÃīleur)\\b",
      "\\b(implÃĐmente[rz]?|code[rz]?|dÃĐveloppe[rz]?|programme[rz]?) .{0,30}(fonction|mÃĐthode|classe|feature|logique|algorithme|endpoint|route|service|contrÃīleur|api|module|composant|script)\\b",
      "\\b(corrige[rz]?|rÃĐpare[rz]?|rÃĐsou[dst]+|dÃĐbogue[rz]?|fixe[rz]?) .{0,20}(bug|erreur|problÃĻme|crash|exception)\\b",
      "\\b(mets? Ã  jour|modifie[rz]?|change[rz]?|ajuste[rz]?) .{0,20}(fonction|mÃĐthode|classe|code|logique|comportement)\\b",
      "\\b(supprime[rz]?|enlÃĻve[rz]?|retire[rz]?|efface[rz]?) .{0,20}(fonction|mÃĐthode|classe|champ|colonne|propriÃĐtÃĐ)\\b",
      "\\b(converti[rstz]+|transforme[rz]?|parse[rz]?|sÃĐrialise[rz]?|dÃĐsÃĐrialise[rz]?)\\b",
      "\\b(valide[rz]?|nettoie[rz]?|vÃĐrifie[rz]? les donnÃĐes|contrÃīle[rz]? l'entrÃĐe)\\b",
      "\\b(ajoute[rz]?|ÃĐcri[rstz]+|crÃĐe[rz]?) .{0,15}(test|spec|test unitaire|test d'intÃĐgration)\\b",
      "\\b(gÃĻre[rz]?|attrape[rz]?|lance[rz]?) .{0,15}(erreur|exception|ÃĐchec)\\b",
      "\\b(connecte[rz]?|intÃĻgre[rz]?|relie[rz]?|branche[rz]?) .{0,20}(api|base de donnÃĐes|service|endpoint)\\b"
    ],
    "deep": [
      "\\b(architecture|conception de systÃĻme|patron de conception)\\b",
      "\\bscalab(le|ilitÃĐ)\\b",
      "\\b(sÃĐcuritÃĐ|vulnÃĐrabilitÃĐ|audit|exploit)\\b",
      "\\b(dans tous les|plusieurs|multiples) (fichiers?|composants?|modules?)\\b",
      "\\brefactor.{0,20}(codebase|projet|entier|complet)\\b",
      "\\b(compromis|comparer?|avantages? et inconvÃĐnients?)\\b",
      "\\b(analys|ÃĐvalu|compar).{0,30}(option|approche|stratÃĐg)\\b",
      "\\b(complexe|ÃĐlaborÃĐ|sophistiquÃĐ)\\b",
      "\\boptimis.{0,20}(performance|vitesse|mÃĐmoire)\\b",
      "\\b(migration|extraction).{0,20}(plan|stratÃĐgie)\\b",
      "\\b(revue de code|bonnes pratiques|meilleures pratiques)\\b"
    ],
    "tool_intensive": [
      "\\b(chercher|rechercher|trouver|grep) .{0,20}(dans|parmi|entre)\\b",
      "\\b(modifier|changer|mettre Ã  jour|ÃĐditer) .{0,20}(fichiers?|modules?)\\b",
      "\\b(exÃĐcuter|lancer|dÃĐmarrer) .{0,20}(tests?|specs?)\\b",
      "\\b(installer|ajouter|supprimer) .{0,20}(dÃĐpendance|paquet|bibliothÃĻque)\\b",
      "\\b(compiler|construire|builder)\\b",
      "\\b(dÃĐployer|publier|livrer)\\b",
      "\\b(vÃĐrifier|contrÃīler) .{0,15}(ÃĐtat|logs?|santÃĐ)\\b"
    ],
    "orchestration": [
      "\\b(ÃĐtape par ÃĐtape|phase par phase|pas Ã  pas)\\b",
      "\\b(d'abord|ensuite|puis|finalement).{0,30}(ensuite|puis|finalement)\\b",
      "\\b(plan complet|implÃĐmentation complÃĻte|pipeline complet)\\b",
      "\\b(de bout en bout|de zÃĐro|depuis le dÃĐbut)\\b",
      "\\bmulti.?ÃĐtape\\b",
      "\\b(crÃĐer de zÃĐro|implÃĐmenter complÃĻtement)\\b"
    ]
  },
  "follow_up_patterns": [
    "^(et |mais |aussi |maintenant |alors )",
    "^(ok|oui|bien|parfait|d'accord|super)[,.]? ",
    "\\b(ce qui prÃĐcÃĻde|Ã§a|la mÃŠme chose|ce que tu as dit)\\b",
    "\\b(continue|poursuis|avance|va de l'avant)\\b",
    "^(fais-le|vas-y|Ã§a semble bien|excellent|parfait)"
  ]
}
