{
  "code": "ja",
  "name": "日本語",
  "stopwords": [
    "の", "は", "が", "を", "に", "で", "と", "も", "です", "ます",
    "する", "いる", "ある", "この", "その", "これ", "それ", "から",
    "まで", "より", "へ", "か", "な", "よ", "ね", "けど", "だ",
    "った", "ない", "なる", "れる", "られる", "たい", "て", "た",
    "し", "さ", "れ", "こと", "もの", "ところ", "時", "人", "方",
    "前", "後", "中", "上", "下", "私", "あなた", "彼", "彼女",
    "私たち", "など", "という", "について", "として", "ように"
  ],
  "patterns": {
    "fast": [
      "^(こんにちは|こんばんは|おはよう|ありがとう|さようなら|どうも|やあ)[!、。\\s]?$",
      "^(はい|いいえ|了解|わかりました|いいですよ|大丈夫|承知|OK|オッケー)[!、。\\s]?$",
      "^(何|なに)(は|が|を|ですか)",
      "^どう(やって|すれば|したら)",
      "^(表示|一覧|リスト|見せて|教えて) .{0,20}$",
      "(フォーマット|整形|きれいにする|翻訳|変換|リネーム|ソート|クリーン)",
      "\\bgit (status|log|diff|add|commit|push|pull|branch|checkout|merge|stash|rebase)\\b",
      "\\b(json|yaml|yml|toml|csv|xml|html|markdown|md)\\b.{0,15}$",
      "\\bregex\\b",
      "(構文|シンタックス)(は|を|について)",
      "^(何|どう|どのように|どこ|どれ).{0,40}[?？]$",
      "^(説明|記述|要約|定義).{0,30}$"
    ],
    "standard": [
      "(作成|書いて|作って|追加|構築).{0,15}(関数|メソッド|クラス|コンポーネント|モジュール|ハンドラ|エンドポイント|ルート|サービス|コントローラ)",
      "(実装|コーディング|開発|プログラム).{0,20}(関数|メソッド|クラス|機能|ロジック|アルゴリズム|エンドポイント|ルート|サービス|コントローラ|API|モジュール|コンポーネント|スクリプト)",
      "(修正|直して|解決|修復|デバッグ).{0,15}(バグ|エラー|問題|クラッシュ|例外)",
      "(更新|変更|修正|調整).{0,15}(関数|メソッド|クラス|コード|ロジック|動作)",
      "(削除|除去|取り除).{0,15}(関数|メソッド|クラス|フィールド|カラム|プロパティ)",
      "(変換|パース|シリアライズ|デシリアライズ)",
      "(バリデーション|サニタイズ|入力チェック|データ検証)",
      "(追加|書いて|作成).{0,10}(テスト|スペック|ユニットテスト|統合テスト)",
      "(ハンドル|キャッチ|スロー).{0,10}(エラー|例外|失敗)",
      "(接続|統合|連携|接入).{0,15}(API|データベース|サービス|エンドポイント)"
    ],
    "deep": [
      "(アーキテクチャ|設計パターン|システム設計)",
      "(スケーラブル|スケーラビリティ|拡張性)",
      "(セキュリティ|脆弱性|監査|ペネトレーション)",
      "(すべての|複数の|各)(ファイル|コンポーネント|モジュール)(に|で|を)",
      "リファクタリング.{0,15}(コードベース|プロジェクト|全体)",
      "(トレードオフ|比較|メリットとデメリット)",
      "(分析|評価|比較).{0,20}(オプション|アプローチ|戦略)",
      "(複雑|複雑性|高度)",
      "最適化.{0,15}(パフォーマンス|速度|メモリ)",
      "(マイグレーション|抽出).{0,15}(計画|戦略)",
      "(コードレビュー|ベストプラクティス|設計原則)"
    ],
    "tool_intensive": [
      "(検索|探す|見つける|grep).{0,15}(で|から|の中)",
      "(変更|更新|編集|修正).{0,15}(ファイル|モジュール)",
      "(実行|走らせる|起動).{0,15}(テスト|spec)",
      "(インストール|追加|削除).{0,15}(依存関係|パッケージ|ライブラリ)",
      "(コンパイル|ビルド|バンドル)",
      "(デプロイ|リリース|公開)",
      "(確認|チェック).{0,10}(ステータス|ログ|状態)"
    ],
    "orchestration": [
      "(ステップバイステップ|一歩一歩|段階的に)",
      "(まず|次に|それから|最後に).{0,20}(次に|それから|最後に)",
      "(完全な計画|完全な実装|全パイプライン)",
      "(エンドツーエンド|ゼロから|最初から)",
      "マルチステップ",
      "(ゼロから作る|完全に実装する|全体を設計する)"
    ]
  },
  "follow_up_patterns": [
    "^(そして|でも|それから|では|次に)",
    "^(はい|わかりました|了解|なるほど|いいですね)[,、.。]?",
    "(上記|これ|同じ|あなたが言った)(の|を|について)?",
    "(続けて|次に|進めて|続きを)",
    "^(やってみて|進めて|いいですね|素晴らしい|完璧)"
  ]
}
