{
  "code": "ko",
  "name": "한국어",
  "stopwords": [
    "은", "는", "이", "가", "을", "를", "에", "의", "로", "와",
    "과", "도", "만", "까지", "부터", "에서", "으로", "보다", "처럼",
    "같이", "한", "하는", "된", "인", "적", "들", "것", "수", "등",
    "때", "중", "및", "그", "이것", "저", "이런", "그런", "어떤",
    "모든", "각", "다른", "더", "많은", "좀", "잘", "못", "안",
    "또", "너무", "아주", "매우", "제", "저의", "우리", "여기",
    "저기", "지금", "이미", "아직", "항상", "때문에", "위해"
  ],
  "patterns": {
    "fast": [
      "^무엇(이|은|는|을|가)",
      "^어떻게",
      "^(보여|알려|나열해)(줘|주세요|주겠어)",
      "\\b(포맷|형식 맞추기|정리)\\b",
      "\\bgit (status|log|diff|add|commit|push|pull|branch|checkout|merge)\\b",
      "\\b(json|yaml|yml|toml|csv)\\b.{0,15}$",
      "\\bregex\\b",
      "(문법|구문)(은|이|를|에 대해)",
      "^(무엇|어떻게|어떤).{0,40}[?？]$"
    ],
    "standard": [
      "(생성|작성|만들어|추가|구축).{0,15}(함수|메서드|클래스|컴포넌트|모듈|핸들러|엔드포인트|라우트|서비스|컨트롤러)",
      "(구현|코딩|개발|프로그래밍).{0,20}(함수|메서드|클래스|기능|로직|알고리즘)",
      "(수정|고쳐|해결|패치|디버그).{0,15}(버그|에러|오류|문제|크래시|예외)",
      "(업데이트|변경|수정|조정).{0,15}(함수|메서드|클래스|코드|로직|동작)",
      "(삭제|제거|지워).{0,15}(함수|메서드|클래스|필드|컬럼|속성)",
      "(변환|파싱|직렬화|역직렬화)",
      "(검증|유효성 검사|입력 확인|데이터 검증)",
      "(추가|작성|생성).{0,10}(테스트|스펙|유닛 테스트|통합 테스트)",
      "(처리|캐치|던지기).{0,10}(에러|예외|실패)",
      "(연결|통합|연동|접속).{0,15}(API|데이터베이스|서비스|엔드포인트)"
    ],
    "deep": [
      "(아키텍처|시스템 설계|디자인 패턴)",
      "(확장 가능|확장성|스케일링)",
      "(보안|취약점|감사|침투 테스트)",
      "(모든|여러|각각의)(파일|컴포넌트|모듈)(에서|에|을|를)",
      "리팩토링.{0,15}(코드베이스|프로젝트|전체)",
      "(트레이드오프|비교|장단점)",
      "(분석|평가|비교).{0,20}(옵션|방법|전략)",
      "(복잡|복잡성|고급)",
      "최적화.{0,15}(성능|속도|메모리)",
      "(마이그레이션|추출).{0,15}(계획|전략)",
      "(코드 리뷰|모범 사례|설계 원칙)"
    ],
    "tool_intensive": [
      "(검색|찾기|찾아|grep).{0,15}(에서|안에|중에서)",
      "(수정|변경|업데이트|편집).{0,15}(파일|모듈)",
      "(실행|돌리기|시작).{0,15}(테스트|spec)",
      "(설치|추가|제거|삭제).{0,15}(의존성|패키지|라이브러리)",
      "(컴파일|빌드|번들)",
      "(배포|릴리즈|게시)",
      "(확인|체크).{0,10}(상태|로그|건강)"
    ],
    "orchestration": [
      "(단계별로|차례대로|순서대로)",
      "(먼저|그다음|그리고|마지막으로).{0,20}(그다음|그리고|마지막으로)",
      "(완전한 계획|완전한 구현|전체 파이프라인)",
      "(처음부터 끝까지|처음부터|제로부터)",
      "다단계",
      "(처음부터 만들기|완전히 구현|전체 설계)"
    ]
  },
  "follow_up_patterns": [
    "^(그리고|하지만|또한|이제|다음으로)",
    "^(네|알겠어요|이해했어요|좋아요|완벽해요)[,、.。]?",
    "(위의|이것|동일한|당신이 말한)(것|내용|부분)?",
    "(계속|진행|다음|계속 해줘)",
    "^(해줘|진행해|좋아|훌륭해|완벽해)"
  ]
}
