{
  "code": "es",
  "name": "Español",
  "stopwords": [
    "el", "la", "los", "las", "un", "una", "unos", "unas",
    "de", "del", "al", "en", "con", "por", "para", "sin",
    "que", "es", "son", "está", "están", "fue", "ser", "hay",
    "este", "esta", "estos", "estas", "ese", "esa",
    "su", "sus", "mi", "tu", "y", "o", "pero", "como",
    "más", "no", "si", "ya", "se", "le", "lo", "me",
    "qué", "cómo", "cuál", "dónde", "quién", "cuándo"
  ],
  "patterns": {
    "fast": [
      "^(hola|hey|gracias|adiós|chao|buenas|buenos días|buenas tardes|buenas noches)[!.,\\s]?$",
      "^(ok|vale|listo|sí|no|perfecto|genial|bien|dale|va|claro|entendido|de acuerdo)[!.,\\s]?$",
      "^(qué|cuál) (es|son|significa) ",
      "^cómo (se|puedo|hago|funciona) ",
      "^(muestra|lista|dame|pon|dime|muéstrame|enséñame) .{0,30}$",
      "\\b(formatea|ordena|limpia|arregla el formato|traduce|convierte|renombra)\\b",
      "\\bgit (status|log|diff|add|commit|push|pull|branch|checkout|merge|stash|rebase)\\b",
      "\\b(json|yaml|yml|toml|csv|xml|html|markdown|md)\\b.{0,20}$",
      "\\bregex\\b",
      "\\bsintaxis (de|para)\\b",
      "^(qué|cómo|dónde|cuál|cuándo).{0,50}\\?$",
      "^(explica|describe|resume|define) .{0,40}$"
    ],
    "standard": [
      "\\b(crea|escribe|haz|agrega|a[ñn]ade|construye) .{0,60}(funci[oó]n|m[eé]todo|clase|componente|m[oó]dulo|handler|endpoint|ruta|servicio|controlador|formulario|modal|tabla|bot[oó]n|campo|columna|migraci[oó]n|par[aá]metro|spinner|wrapper|toggle|variable|cache|filtro|helper|dropdown|di[aá]logo)\\b",
      "\\b(implementa|codifica|desarrolla|programa) .{0,60}(funci[oó]n|m[eé]todo|clase|feature|l[oó]gica|algoritmo|endpoint|ruta|servicio|controlador|api|m[oó]dulo|componente|script|sistema|comportamiento|flujo|cola|worker|soft-?delete)\\b",
      "\\b(autenticaci[oó]n|JWT|OAuth|token|login|sesión|sesi[oó]n|credencial)\\b",
      "\\b(arregla|corrige|soluciona|repara|debuggea|debugea) .{0,30}(bug|error|fallo|problema|crash|excepci[oó]n|regresi[oó]n)\\b",
      "\\b(actualiza|modifica|cambia|ajusta|extiende) .{0,60}(funci[oó]n|m[eé]todo|clase|c[oó]digo|l[oó]gica|comportamiento|modelo|schema|config|readme|documentaci[oó]n|ruta|middleware)\\b",
      "\\b(elimina|borra|quita|remueve) .{0,30}(funci[oó]n|m[eé]todo|clase|campo|columna|propiedad|entrada|item)\\b",
      "\\b(refactoriza[r]?|reestructura[r]?)\\b",
      "\\b(convierte|transforma|parsea|serializa|deserializa)\\b",
      "\\b(valida|sanitiza|verifica datos|checa input)\\b",
      "\\b(agrega|a[ñn]ade|escribe|crea) .{0,30}(test|prueba|spec|test unitario|test de integraci[oó]n|test e2e)\\b",
      "\\b(maneja|atrapa|lanza) .{0,30}(error|excepci[oó]n|fallo|timeout|retry)\\b",
      "\\b(conecta|integra|engancha|enlaza) .{0,30}(api|base de datos|servicio|endpoint|cola)\\b",
      "\\b(agrega|a[ñn]ade|implementa|crea|actualiza|modifica|cachea|maneja|inyecta|incluye|integra|extiende) (un|una|el|la|los|las|nuevo|nueva|nuevos|nuevas|algun[oa]?) \\w{3,}",
      "\\b(cachea|memoiza) .{0,40}(resultado|respuesta|valor|query|llamada)\\b",
      "\\b(agrega|a[ñn]ade|pon) .{0,20}(variable de entorno|env var)\\b",
      "\\b(soft.?delete|retry.?on.?timeout|paginaci[oó]n|modo oscuro|dark mode|spinner de carga)\\b"
    ],
    "deep": [
      "\\b(arquitectura|arquitect[aáoó]|dise[ñn]o de sistema|patr[oó]n de dise[ñn]o)\\b",
      "\\bescalab(le|ilidad)\\b",
      "\\b(seguridad|vulnerab|auditor[ií]a|exploit|autenticaci[oó]n|autorizaci[oó]n|cifrado|encriptaci[oó]n)\\b",
      "\\b(todos los|m[uú]ltiples|varios|entre) (archivos?|componentes?|m[oó]dulos?|servicios?|regiones?|capas?|goroutines?)\\b",
      "\\brefactor.{0,20}(codebase|proyecto|entero|completo|mayor|cr[ií]tico|estrat[eé]gico)\\b",
      "\\b(trade-?off|comparar?|pros? y contras?)\\b",
      "\\b(analiz|evalu|compar).{0,30}(opci|enfoque|estrateg|alternativ)",
      "\\b(complejo|intrincado|sofisticado)\\b",
      "\\boptimiz.{0,20}(rendimiento|velocidad|memoria)\\b",
      "\\b(migraci[oó]n|extracci[oó]n).{0,20}(plan|estrategia)\\b",
      "\\b(estrategia|plan).{0,20}(migraci|extracci)",
      "\\b(piensa|razona|analiza) .{0,20}(bien|profund|detallad)\\b",
      "\\b(mejor|[oó]ptim|ideal) (enfoque|soluci[oó]n|estrategia|forma)\\b",
      "\\b(planea|planifica|dise[ñn]a) .{0,15}(c[oó]mo|implementaci[oó]n|enfoque)\\b",
      "\\b(revisa|audita|inspecciona) .{0,20}(todo|completo|entero)\\b",
      "\\b(cr[ií]tico|importante|crucial)\\b",
      "\\b(varias|m[uú]ltiples|diferentes) (opciones|alternativas|enfoques)\\b",
      "\\b(diagnostica|investiga) .{0,20}(causa ra[ií]z|problema de fondo)\\b",
      "\\b(reescribe|redise[ñn]\\w*|replantea|reestructura|re.?arquitectura)\\b",
      "\\b(a fondo|en profundidad|detalladamente|minuciosamente)\\b",
      "\\b(distribuid[oa]?|multi.?regi[oó]n|multi.?tenant|zero.?downtime|cross.?regi[oó]n|cross.?servicio|event.?driven|event-?driven)\\b",
      "\\b(failover|falla en cascada|fallas en cascada|evoluci[oó]n de schema|bounded contexts?|contextos?\\s+acotados?|flujo de eventos|rate limiter|estrategia de caching|idempotenci)\\b",
      "\\b(fuga de memoria|memory leak|latencia p99|p99 latency|pico de latencia|condici[oó]n de carrera|modelo de consistencia)\\b",
      "\\b(traza|rastrea|debuggea|diagnostica|analiza|investiga) .{0,80}(entre|a trav[eé]s|abarca|abarcando) \\w+",
      "\\b(dise[ñn]a|arquitecta|descompone|propone|planea|devise) .{0,60}(estrategia|capa|pipeline|sistema|arquitectura|ciclo|subsistema|boundary|bounded contexts?|contextos?\\s+acotados?|plataforma|consumer group|monolito|monol[ií]tico)\\b",
      "\\b(architectural decision record|ADR|monolito modular|monolito a microservicios|message queue consumer)\\b"
    ],
    "tool_intensive": [
      "\\b(busca|encuentra|grep|buscar) .{0,20}(en|dentro|entre)\\b",
      "\\b(modifica|cambia|actualiza|edita) .{0,20}(archivos?|ficheros?|módulos?)\\b",
      "\\b(ejecuta|corre|lanza) .{0,20}(tests?|pruebas?|specs?)\\b",
      "\\b(instala|agrega|quita) .{0,20}(dependencia|paquete|librería)\\b",
      "\\b(compila|construye|buildea)\\b",
      "\\b(despliega|deploya|publica)\\b",
      "\\b(revisa|checa) .{0,15}(estado|logs?|salud)\\b"
    ],
    "orchestration": [
      "\\b(paso a paso|fase por fase|etapa por etapa)\\b",
      "\\b(primero|después|luego|finalmente).{0,30}(después|luego|finalmente)\\b",
      "\\b(plan completo|implementación completa|pipeline completo)\\b",
      "\\b(de punta a punta|desde cero|desde el inicio)\\b",
      "\\bmulti.?paso\\b"
    ]
  },
  "follow_up_patterns": [
    "^(y |pero |además |también |ahora )",
    "^(ok|bien|listo|perfecto|dale|va|sí)[,.]? ",
    "\\b(lo anterior|eso|lo mismo|lo que dijiste)\\b",
    "\\b(continúa|sigue|prosigue|avanza|adelante)\\b",
    "^(hazlo|dale|suena bien|excelente|genial)"
  ]
}
