{
  "code": "en",
  "name": "English",
  "stopwords": [
    "the", "a", "an", "is", "are", "was", "were", "be", "been",
    "being", "have", "has", "had", "do", "does", "did", "will",
    "would", "could", "should", "may", "might", "shall", "can",
    "to", "of", "in", "for", "on", "with", "at", "by", "from",
    "this", "that", "these", "those", "it", "its", "my", "your",
    "and", "or", "but", "not", "if", "then", "than", "when", "what",
    "how", "which", "who", "where", "why"
  ],
  "patterns": {
    "fast": [
      "^(hello|hi|hey|yo|sup|thanks|thank you|bye|goodbye)[!.,\\s]?$",
      "^(ok|okay|yes|no|sure|done|got it|right|perfect|great|cool|nice|fine|agreed|noted)[!.,\\s]?$",
      "^what (is|are|does) ",
      "^how (do|does|to) ",
      "^(show|list|get|display|print|count|check) .{0,30}$",
      "\\b(format|lint|prettify|beautify|sort|clean|rename|translate|convert)\\b",
      "\\bgit (status|log|diff|add|commit|push|pull|branch|checkout|merge|stash|rebase)\\b",
      "\\b(json|yaml|yml|toml|csv|xml|html|markdown|md)\\b.{0,20}$",
      "\\bregex\\b",
      "\\bsyntax (for|of)\\b",
      "^(what|how|where|which|when).{0,50}\\?$",
      "^(explain|describe|summarize|define) .{0,40}$"
    ],
    "standard": [
      "\\b(create|write|make|add|build) .{0,20}(function|method|class|component|module|handler|endpoint|route|service|controller)\\b",
      "\\b(implement|code|develop|program) .{0,30}(function|method|class|feature|logic|algorithm|endpoint|route|service|controller|api|module|component|script)\\b",
      "\\b(fix|debug|resolve|patch|repair) .{0,20}(bug|error|issue|problem|crash|exception)\\b",
      "\\b(update|modify|change|adjust|tweak) .{0,20}(function|method|class|code|logic|behavior)\\b",
      "\\b(delete|remove|drop) .{0,20}(function|method|class|field|column|property)\\b",
      "\\b(convert|transform|parse|serialize|deserialize)\\b",
      "\\b(validate|sanitize|check input|verify data)\\b",
      "\\b(add|write|create) .{0,15}(test|spec|unit test|integration test)\\b",
      "\\b(handle|catch|throw) .{0,15}(error|exception|failure)\\b",
      "\\b(connect|integrate|hook up|wire) .{0,20}(api|database|service|endpoint)\\b"
    ],
    "deep": [
      "\\b(architect|architecture|design pattern|system design)\\b",
      "\\bscalab(le|ility)\\b",
      "\\b(security|vulnerab|audit|penetration|exploit)\\b",
      "\\b(across|multiple|all) (files?|components?|modules?)\\b",
      "\\brefactor.{0,20}(codebase|project|entire|complete)\\b",
      "\\b(trade-?off|compare|pros? (and|&) cons?)\\b",
      "\\b(analy[sz]e|evaluate|assess).{0,30}(option|approach|strateg)\\b",
      "\\b(complex|intricate|sophisticated)\\b",
      "\\boptimi[sz](e|ation).{0,20}(performance|speed|memory)\\b",
      "\\b(migration|standalone|extraction).{0,20}(plan|strategy)\\b",
      "\\b(think|reason|analy[sz]e) .{0,20}(careful|deep|thorough)\\b",
      "\\b(best|optimal|ideal) (approach|solution|strategy|way)\\b",
      "\\b(plan|design|architect) .{0,15}(how|implementation|approach)\\b",
      "\\b(review|audit|inspect) .{0,20}(entire|whole|full|complete)\\b",
      "\\b(critical|important|crucial).{0,20}(get.{0,5}right|correct|accurate)\\b",
      "\\b(multiple|several|many) (options?|alternatives?|approaches?)\\b",
      "\\b(debug|diagnose|investigate) .{0,20}(root cause|underlying|intermittent)\\b",
      "\\b(rewrite|redesign|rethink|overhaul)\\b",
      "\\bin.depth\\b"
    ],
    "tool_intensive": [
      "\\b(search|find|grep|look for) .{0,20}(in|across|within)\\b",
      "\\b(modify|change|update|edit) .{0,20}(files?|modules?)\\b",
      "\\b(run|execute) .{0,20}(tests?|specs?|suite)\\b",
      "\\b(install|add|remove) .{0,20}(dependency|package|library)\\b",
      "\\b(build|compile|bundle)\\b",
      "\\b(deploy|ship|release)\\b",
      "\\bcheck .{0,15}(status|health|logs?)\\b"
    ],
    "orchestration": [
      "\\b(step by step|phase by phase|stage by stage)\\b",
      "\\b(first|then|next|finally|after that).{0,30}(then|next|finally|after that)\\b",
      "\\b(complete plan|full implementation|entire pipeline)\\b",
      "\\b(end.to.end|from scratch|ground up)\\b",
      "\\bmulti.?step\\b"
    ]
  },
  "follow_up_patterns": [
    "^(and |but |also |now |then )",
    "^(ok|okay|yes|sure|right|got it|thanks)[,.]? ",
    "\\b(the above|that|this|it|the same|what you said)\\b",
    "\\b(continue|go on|proceed|next|keep going)\\b",
    "^(do it|go ahead|sounds good|perfect|great)"
  ]
}
