{
  "code": "pt",
  "name": "Portuguรชs",
  "stopwords": [
    "o", "a", "os", "as", "de", "em", "que", "por", "para", "com",
    "um", "uma", "do", "da", "no", "na", "se", "ao", "ou", "mas",
    "como", "mais", "seu", "sua", "estรก", "sรฃo", "foi", "ter", "hรก",
    "nos", "jรก", "ele", "ela", "isso", "isto", "esse", "essa", "muito",
    "bem", "tambรฉm", "pode", "aqui", "agora", "quando", "onde", "quem",
    "qual", "todo", "cada", "entre", "dos", "das", "nos", "nas", "pelo",
    "pela", "pelos", "pelas", "num", "numa", "nuns", "numas", "dum", "duma"
  ],
  "patterns": {
    "fast": [
      "^(o que|qual) (รฉ|sรฃo) ",
      "^como (faรงo|posso|funciona) ",
      "^(mostre|liste|exiba|diga) .{0,30}$",
      "\\b(formatar|formata|formateie)\\b",
      "\\bgit (status|log|diff|add|commit|push|pull|branch|checkout|merge)\\b",
      "\\b(json|yaml|yml|toml|csv)\\b.{0,20}$",
      "\\bregex\\b",
      "\\bsintaxe (de|para|do|da)\\b",
      "^(o que|como).{0,50}\\?$"
    ],
    "standard": [
      "\\b(crie|escreva|faรงa|adicione|construa) .{0,20}(funรงรฃo|mรฉtodo|classe|componente|mรณdulo|handler|endpoint|rota|serviรงo|controlador)\\b",
      "\\b(implemente|implementa|codifique|codifica|desenvolva|desenvolve|programe|programa) .{0,30}(funรงรฃo|mรฉtodo|classe|feature|lรณgica|algoritmo|endpoint|rota|serviรงo|controlador|api|mรณdulo|componente|script)\\b",
      "\\b(corrija|conserte|resolva|repare|debugue) .{0,20}(bug|erro|falha|problema|crash|exceรงรฃo)\\b",
      "\\b(atualize|modifique|altere|ajuste) .{0,20}(funรงรฃo|mรฉtodo|classe|cรณdigo|lรณgica|comportamento)\\b",
      "\\b(delete|remova|exclua|apague) .{0,20}(funรงรฃo|mรฉtodo|classe|campo|coluna|propriedade)\\b",
      "\\b(converta|transforme|parse|serialize|deserialize)\\b",
      "\\b(valide|sanitize|verifique dados|cheque input)\\b",
      "\\b(adicione|escreva|crie) .{0,15}(teste|spec|teste unitรกrio|teste de integraรงรฃo)\\b",
      "\\b(trate|capture|lance) .{0,15}(erro|exceรงรฃo|falha)\\b",
      "\\b(conecte|integre|ligue|vincule) .{0,20}(api|banco de dados|serviรงo|endpoint)\\b"
    ],
    "deep": [
      "\\b(arquitetura|design de sistema|padrรฃo de projeto)\\b",
      "\\bescalรกv(el|el|ilidade)\\b",
      "\\b(seguranรงa|vulnerabilidade|auditoria|exploit)\\b",
      "\\b(em todos os|mรบltiplos|vรกrios) (arquivos?|componentes?|mรณdulos?)\\b",
      "\\brefator.{0,20}(codebase|projeto|inteiro|completo)\\b",
      "\\b(trade-?off|comparar?|prรณs e contras?)\\b",
      "\\b(analisa|avalia|compara).{0,30}(opรงรฃo|abordagem|estratรฉgia)\\b",
      "\\b(complexo|intrincado|sofisticado)\\b",
      "\\botimiz.{0,20}(desempenho|velocidade|memรณria)\\b",
      "\\b(migraรงรฃo|extraรงรฃo).{0,20}(plano|estratรฉgia)\\b",
      "\\b(revisรฃo de cรณdigo|code review|boas prรกticas)\\b"
    ],
    "tool_intensive": [
      "\\b(buscar|procurar|encontrar) .{0,20}(em|nos|dentro|entre)\\b",
      "\\b(modificar|alterar|atualizar|editar) .{0,20}(arquivos?|mรณdulos?)\\b",
      "\\b(executar|rodar|iniciar) .{0,20}(testes?|specs?)\\b",
      "\\b(instalar|adicionar|remover) .{0,20}(dependรชncia|pacote|biblioteca)\\b",
      "\\b(compilar|construir|buildar)\\b",
      "\\b(implantar|deploiar|publicar|lanรงar)\\b",
      "\\b(verificar|checar) .{0,15}(estado|logs?|saรบde)\\b"
    ],
    "orchestration": [
      "\\b(passo a passo|etapa por etapa|fase por fase)\\b",
      "\\b(primeiro|depois|em seguida|finalmente).{0,30}(depois|em seguida|finalmente)\\b",
      "\\b(plano completo|implementaรงรฃo completa|pipeline completo)\\b",
      "\\b(de ponta a ponta|do zero|desde o inรญcio)\\b",
      "\\bmulti.?etapa\\b",
      "\\b(criar do zero|implementar completamente)\\b"
    ]
  },
  "follow_up_patterns": [
    "^(e |mas |tambรฉm |agora |entรฃo )",
    "^(ok|certo|sim|claro|perfeito|รณtimo)[,.]? ",
    "\\b(o acima|isso|o mesmo|o que vocรช disse)\\b",
    "\\b(continua|continuar|segue|prossegue|avanรงa)\\b",
    "^(faรงa isso|pode ir|soa bem|excelente|รณtimo)"
  ]
}
