{
  "code": "ru",
  "name": "袪褍褋褋泻懈泄",
  "stopwords": [
    "懈", "胁", "薪械", "薪邪", "褟", "褔褌芯", "芯薪", "褋", "褝褌芯", "泻邪泻",
    "械谐芯", "写谢褟", "锌芯", "芯薪邪", "薪芯", "芯薪懈", "屑褘", "芯褌", "斜褘谢",
    "斜褘", "胁褋械", "褌邪泻", "褍卸械", "胁芯褌", "械褖褢", "懈谢懈", "褌褘", "褌芯",
    "懈蟹", "蟹邪", "写芯", "锌褉懈", "斜械蟹", "械褋褌褜", "斜褘褌褜", "褝褌芯褌", "褝褌邪",
    "褝褌懈", "褌芯褌", "褌邪", "褌械", "褌芯谢褜泻芯", "芯褔械薪褜", "褌芯卸械", "屑芯卸薪芯",
    "谐写械", "泻芯谐写邪", "泻褌芯", "褔械屑", "械褋谢懈", "卸械", "胁褘", "懈褏", "薪械褌",
    "屑薪械", "褌械斜械", "薪邪屑", "薪邪褋", "胁邪褋", "懈屑", "械泄", "械褢", "褋胁芯械泄"
  ],
  "patterns": {
    "fast": [
      "^(锌褉懈胁械褌|蟹写褉邪胁褋褌胁褍泄褌械|褋锌邪褋懈斜芯|锌芯泻邪|写芯 褋胁懈写邪薪懈褟|写芯斜褉褘泄 写械薪褜|写芯斜褉芯械 褍褌褉芯|写芯斜褉褘泄 胁械褔械褉)[!.,\\s]?$",
      "^(芯泻|写邪|薪械褌|褏芯褉芯褕芯|芯褌谢懈褔薪芯|锌芯薪褟谢|谢邪写薪芯|锌褉懈薪褟褌芯|褋芯谐谢邪褋械薪)[!.,\\s]?$",
      "^褔褌芯 (褌邪泻芯械|褝褌芯|蟹薪邪褔懈褌|芯蟹薪邪褔邪械褌) ",
      "^泻邪泻 (褋写械谢邪褌褜|屑芯卸薪芯|褉邪斜芯褌邪械褌|懈褋锌芯谢褜蟹芯胁邪褌褜) ",
      "^(锌芯泻邪卸懈|锌械褉械褔懈褋谢懈|胁褘胁械写懈|写邪泄|锌芯泻邪卸懈 屑薪械) .{0,30}$",
      "\\b(褎芯褉屑邪褌懈褉芯胁邪褌褜|芯褌褎芯褉屑邪褌懈褉芯胁邪褌褜|锌褉懈胁械褋褌懈 胁 锌芯褉褟写芯泻|锌械褉械胁械褋褌懈|泻芯薪胁械褉褌懈褉芯胁邪褌褜|锌械褉械懈屑械薪芯胁邪褌褜|褋芯褉褌懈褉芯胁邪褌褜|芯褔懈褋褌懈褌褜)\\b",
      "\\bgit (status|log|diff|add|commit|push|pull|branch|checkout|merge|stash|rebase)\\b",
      "\\b(json|yaml|yml|toml|csv|xml|html|markdown|md)\\b.{0,20}$",
      "\\bregex\\b",
      "\\b褋懈薪褌邪泻褋懈褋 (写谢褟|芯褌|褔械谐芯)\\b",
      "^(褔褌芯|泻邪泻|谐写械|泻邪泻芯泄|泻芯谐写邪).{0,50}\\?$",
      "^(芯斜褗褟褋薪懈|芯锌懈褕懈|褉械蟹褞屑懈褉褍泄|芯锌褉械写械谢懈) .{0,40}$"
    ],
    "standard": [
      "\\b(褋芯蟹写邪泄|薪邪锌懈褕懈|褋写械谢邪泄|写芯斜邪胁褜|锌芯褋褌褉芯泄) .{0,20}(褎褍薪泻褑懈褞|屑械褌芯写|泻谢邪褋褋|泻芯屑锌芯薪械薪褌|屑芯写褍谢褜|芯斜褉邪斜芯褌褔懈泻|褝薪写锌芯懈薪褌|屑邪褉褕褉褍褌|褋械褉胁懈褋|泻芯薪褌褉芯谢谢械褉)\\b",
      "\\b(褉械邪谢懈蟹褍泄|蟹邪泻芯写懈褉褍泄|褉邪蟹褉邪斜芯褌邪泄|蟹邪锌褉芯谐褉邪屑屑懈褉褍泄) .{0,30}(褎褍薪泻褑懈褞|屑械褌芯写|泻谢邪褋褋|褎懈褔褍|谢芯谐懈泻褍|邪谢谐芯褉懈褌屑|褝薪写锌芯懈薪褌|屑邪褉褕褉褍褌|褋械褉胁懈褋|泻芯薪褌褉芯谢谢械褉|api|屑芯写褍谢褜|泻芯屑锌芯薪械薪褌|褋泻褉懈锌褌)\\b",
      "\\b(懈褋锌褉邪胁褜|锌芯褔懈薪懈|褍褋褌褉邪薪懈|锌褉芯锌邪褌褔懈|芯褌谢邪写褜) .{0,20}(斜邪谐|芯褕懈斜泻褍|锌褉芯斜谢械屑褍|泻褉邪褕|懈褋泻谢褞褔械薪懈械)\\b",
      "\\b(芯斜薪芯胁懈|懈蟹屑械薪懈|锌芯屑械薪褟泄|褋泻芯褉褉械泻褌懈褉褍泄) .{0,20}(褎褍薪泻褑懈褞|屑械褌芯写|泻谢邪褋褋|泻芯写|谢芯谐懈泻褍|锌芯胁械写械薪懈械)\\b",
      "\\b(褍写邪谢懈|褍斜械褉懈|褍斜褉邪褌褜|褍写邪谢懈褌褜) .{0,20}(褎褍薪泻褑懈褞|屑械褌芯写|泻谢邪褋褋|锌芯谢械|泻芯谢芯薪泻褍|褋胁芯泄褋褌胁芯)\\b",
      "(褉械褎邪泻褌芯褉|褉械褋褌褉褍泻褌褍褉懈蟹|锌械褉械褋褌褉芯).{0,15}(泻芯写|褎褍薪泻褑懈|屑械褌芯写|泻谢邪褋褋|泻芯屑锌芯薪械薪褌|屑芯写褍谢|谢芯谐懈泻)",
      "\\b(泻芯薪胁械褉褌懈褉褍泄|锌褉械芯斜褉邪蟹褍泄|褉邪褋锌邪褉褋懈|褋械褉懈邪谢懈蟹褍泄|写械褋械褉懈邪谢懈蟹褍泄)\\b",
      "\\b(胁邪谢懈写懈褉褍泄|芯褔懈褋褌懈|锌褉芯胁械褉褜 写邪薪薪褘械|锌褉芯胁械褉褜 胁胁芯写)\\b",
      "\\b(写芯斜邪胁褜|薪邪锌懈褕懈|褋芯蟹写邪泄) .{0,15}(褌械褋褌|褋锌械泻|褞薪懈褌-褌械褋褌|懈薪褌械谐褉邪褑懈芯薪薪褘泄 褌械褋褌)\\b",
      "\\b(芯斜褉邪斜芯褌邪泄|锌芯泄屑邪泄|斜褉芯褋褜) .{0,15}(芯褕懈斜泻褍|懈褋泻谢褞褔械薪懈械|褋斜芯泄)\\b",
      "\\b(锌芯写泻谢褞褔懈|懈薪褌械谐褉懈褉褍泄|褋胁褟卸懈|锌褉懈胁褟卸懈) .{0,20}(api|斜邪蟹褍 写邪薪薪褘褏|褋械褉胁懈褋|褝薪写锌芯懈薪褌)\\b"
    ],
    "deep": [
      "\\b(邪褉褏懈褌械泻褌褍褉[邪褍褘械]?|锌褉芯械泻褌懈褉芯胁邪薪懈[械褟褞]|写懈蟹邪泄薪 褋懈褋褌械屑褘)\\b",
      "\\b(屑邪褋褕褌邪斜懈褉褍械屑|屑邪褋褕褌邪斜懈褉褍械屑芯褋褌褜)\\b",
      "\\b(斜械蟹芯锌邪褋薪芯褋褌褜|褍褟蟹胁懈屑芯褋褌褜|邪褍写懈褌|褝泻褋锌谢芯泄褌)\\b",
      "\\b(胁芯 胁褋械褏|薪械褋泻芯谢褜泻懈褏|屑薪芯卸械褋褌胁械) (褎邪泄谢邪褏?|泻芯屑锌芯薪械薪褌邪褏?|屑芯写褍谢褟褏?)\\b",
      "\\b褉械褎邪泻褌芯褉.{0,20}(泻芯写芯胁芯泄 斜邪蟹褘|锌褉芯械泻褌邪|褑械谢芯谐芯|锌芯谢薪芯谐芯)\\b",
      "\\b(泻芯屑锌褉芯屑懈褋褋|褋褉邪胁薪懈褌褜|锌谢褞褋褘 懈 屑懈薪褍褋褘)\\b",
      "(邪薪邪谢懈蟹|芯褑械薪泻|褋褉邪胁薪械薪懈).{0,30}(胁邪褉懈邪薪褌|锌芯写褏芯写|褋褌褉邪褌械谐|邪谢褜褌械褉薪邪褌懈胁)",
      "\\b(褋谢芯卸薪褘泄|蟹邪锌褍褌邪薪薪褘泄|薪械褌褉懈胁懈邪谢褜薪褘泄)\\b",
      "\\b芯锌褌懈屑懈蟹邪褑.{0,20}(锌褉芯懈蟹胁芯写懈褌械谢褜薪芯褋褌褜|褋泻芯褉芯褋褌褜|锌邪屑褟褌褜)\\b",
      "\\b(屑懈谐褉邪褑懈褟|懈蟹胁谢械褔械薪懈械).{0,20}(锌谢邪薪|褋褌褉邪褌械谐懈褟)\\b",
      "(褋褌褉邪褌械谐懈褟|锌谢邪薪).{0,20}(屑懈谐褉邪褑|懈蟹胁谢械褔械薪)",
      "\\b(褉械胁褜褞 泻芯写邪|谢褍褔褕懈械 锌褉邪泻褌懈泻懈|code review)\\b",
      "\\b(锌芯写褍屑邪泄|褉邪褋褋褍写懈|锌褉芯邪薪邪谢懈蟹懈褉褍泄) .{0,20}(褏芯褉芯褕芯|谐谢褍斜芯泻芯|褌褖邪褌械谢褜薪芯|写械褌邪谢褜薪芯)\\b",
      "\\b(谢褍褔褕懈泄|芯锌褌懈屑邪谢褜薪褘泄|懈写械邪谢褜薪褘泄) (锌芯写褏芯写|褉械褕械薪懈械|褋褌褉邪褌械谐懈褟|锌褍褌褜)\\b",
      "\\b(褋锌谢邪薪懈褉褍泄|褋锌褉芯械泻褌懈褉褍泄|褉邪蟹褉邪斜芯褌邪泄) .{0,20}(泻邪泻|褉械邪谢懈蟹邪褑懈褞|锌芯写褏芯写|邪褉褏懈褌械泻褌褍褉|褋懈褋褌械屑|懈薪褎褉邪褋褌褉褍泻褌褍褉)\\b",
      "\\b(锌褉芯胁械褉褜|锌褉芯胁械写懈 邪褍写懈褌|芯褋屑芯褌褉懈) .{0,20}(胁械褋褜|锌芯谢薪芯褋褌褜褞|褑械谢懈泻芯屑)\\b",
      "\\b(泻褉懈褌懈褔薪芯|胁邪卸薪芯|褉械褕邪褞褖械)\\b",
      "\\b(薪械褋泻芯谢褜泻芯|屑薪芯卸械褋褌胁芯|褉邪蟹谢懈褔薪褘褏) (胁邪褉懈邪薪褌芯胁|邪谢褜褌械褉薪邪褌懈胁|锌芯写褏芯写芯胁)\\b",
      "\\b(锌褉芯写懈邪谐薪芯褋褌懈褉褍泄|褉邪褋褋谢械写褍泄) .{0,20}(锌褉懈褔懈薪褍|泻芯褉械薪褜 锌褉芯斜谢械屑褘)\\b",
      "\\b(锌械褉械锌懈褕懈|锌械褉械锌褉芯械泻褌懈褉褍泄|锌械褉械芯褋屑褘褋谢懈|锌械褉械褋褌褉芯泄)\\b",
      "\\b(褍谐谢褍斜谢褢薪薪芯|写械褌邪谢褜薪芯|褌褖邪褌械谢褜薪芯|写芯褋泻芯薪邪谢褜薪芯)\\b"
    ],
    "tool_intensive": [
      "\\b(薪邪泄褌懈|锌芯懈褋泻邪褌褜|懈褋泻邪褌褜|grep) .{0,20}(胁|胁薪褍褌褉懈|褋褉械写懈)\\b",
      "\\b(懈蟹屑械薪懈褌褜|芯斜薪芯胁懈褌褜|芯褌褉械写邪泻褌懈褉芯胁邪褌褜) .{0,20}(褎邪泄谢邪褏?|屑芯写褍谢褟褏?)\\b",
      "\\b(蟹邪锌褍褋褌懈褌褜|胁褘锌芯谢薪懈褌褜) .{0,20}(褌械褋褌褘?|specs?)\\b",
      "\\b(褍褋褌邪薪芯胁懈褌褜|写芯斜邪胁懈褌褜|褍写邪谢懈褌褜) .{0,20}(蟹邪胁懈褋懈屑芯褋褌褜|锌邪泻械褌|斜懈斜谢懈芯褌械泻邪)\\b",
      "\\b(褋泻芯屑锌懈谢懈褉芯胁邪褌褜|褋芯斜褉邪褌褜|褋斜懈谢写懈褌褜)\\b",
      "\\b(蟹邪写械锌谢芯懈褌褜|褉邪蟹胁械褉薪褍褌褜|芯锌褍斜谢懈泻芯胁邪褌褜)\\b",
      "\\b(锌褉芯胁械褉懈褌褜|锌芯褋屑芯褌褉械褌褜) .{0,15}(褋褌邪褌褍褋|谢芯谐懈?|褋芯褋褌芯褟薪懈械)\\b"
    ],
    "orchestration": [
      "\\b(褕邪谐 蟹邪 褕邪谐芯屑|锌芯 褕邪谐邪屑|锌芯褝褌邪锌薪芯)\\b",
      "\\b(褋薪邪褔邪谢邪|蟹邪褌械屑|锌芯褌芯屑|薪邪泻芯薪械褑).{0,30}(蟹邪褌械屑|锌芯褌芯屑|薪邪泻芯薪械褑)\\b",
      "\\b(锌芯谢薪褘泄 锌谢邪薪|锌芯谢薪邪褟 褉械邪谢懈蟹邪褑懈褟|胁械褋褜 锌邪泄锌谢邪泄薪)\\b",
      "\\b(芯褌 薪邪褔邪谢邪 写芯 泻芯薪褑邪|褋 薪褍谢褟|褋 褋邪屑芯谐芯 薪邪褔邪谢邪)\\b",
      "\\b屑薪芯谐芯褝褌邪锌薪\\b",
      "\\b(褋芯蟹写邪褌褜 褋 薪褍谢褟|锌芯谢薪芯褋褌褜褞 褉械邪谢懈蟹芯胁邪褌褜)\\b"
    ]
  },
  "follow_up_patterns": [
    "^(懈 |薪芯 |褌邪泻卸械 |褌械锌械褉褜 |锌芯褌芯屑 )",
    "^(ok|褏芯褉芯褕芯|写邪|泻芯薪械褔薪芯|芯褌谢懈褔薪芯|锌芯薪褟谢)[,.]? ",
    "\\b(胁褘褕械褋泻邪蟹邪薪薪芯械|褝褌芯|褌芯 卸械 褋邪屑芯械|褌芯 褔褌芯 褌褘 褋泻邪蟹邪谢)\\b",
    "\\b(锌褉芯写芯谢卸邪泄|写邪谢褜褕械|锌褉芯写芯谢卸懈褌褜|锌褉芯写芯谢卸邪泄)\\b",
    "^(褋写械谢邪泄 褝褌芯|写邪胁邪泄|蟹胁褍褔懈褌 褏芯褉芯褕芯|芯褌谢懈褔薪芯|褋褍锌械褉)"
  ]
}
